{
  "test_id": "chart_to_task_post_001",
  "scenario": "chart_to_task",
  "test_type": "post_test",
  "description": "Post-test for chart to task scenario - assesses learning after tutoring session",
  "questions": [
    {
      "question_id": "q1",
      "question_text": "A teacher wants to show which of 6 departments has the highest budget. What analytical task is this and which chart is best?",
      "options": [
        {"option_id": "A", "text": "Trend task - use line chart"},
        {"option_id": "B", "text": "Comparison task - use bar or column chart"},
        {"option_id": "C", "text": "Distribution task - use histogram"},
        {"option_id": "D", "text": "Composition task - use pie chart"}
      ],
      "correct_answer": "B",
      "explanation": "Comparing values across departments is a comparison task, best visualized with bars or columns.",
      "subskill": "match_comparison_tasks_to_bars_or_columns"
    },
    {
      "question_id": "q2",
      "question_text": "You need to visualize how website conversions changed week-by-week over Q1. What task and chart?",
      "options": [
        {"option_id": "A", "text": "Comparison task - bar chart"},
        {"option_id": "B", "text": "Distribution task - histogram"},
        {"option_id": "C", "text": "Trend task - line or area chart"},
        {"option_id": "D", "text": "Composition task - stacked bar"}
      ],
      "correct_answer": "C",
      "explanation": "Showing change over time periods is a trend analysis task, ideal for line or area charts.",
      "subskill": "match_trend_tasks_to_lines_or_areas"
    },
    {
      "question_id": "q3",
      "question_text": "An analyst wants to see the range and distribution of ages in a customer dataset. Which chart family supports this goal?",
      "options": [
        {"option_id": "A", "text": "Line chart"},
        {"option_id": "B", "text": "Pie chart"},
        {"option_id": "C", "text": "Histogram or box plot"},
        {"option_id": "D", "text": "Simple bar chart"}
      ],
      "correct_answer": "C",
      "explanation": "Distribution tasks showing spread and range are best served by histograms, box plots, or violin plots.",
      "subskill": "select_distribution_views_for_spread"
    },
    {
      "question_id": "q4",
      "question_text": "Before choosing a chart, what should you clarify about the analytical task?",
      "options": [
        {"option_id": "A", "text": "What colors to use"},
        {"option_id": "B", "text": "The intent: comparison, trend, distribution, composition, or correlation"},
        {"option_id": "C", "text": "The size of the chart"},
        {"option_id": "D", "text": "The font for labels"}
      ],
      "correct_answer": "B",
      "explanation": "Understanding the analytical intent (comparison, trend, etc.) is crucial for selecting an appropriate chart type.",
      "subskill": "identify_task_intent"
    }
  ]
}
