{
  "test_id": "type_to_chart_post_001",
  "scenario": "type_to_chart",
  "test_type": "post_test",
  "description": "Post-test for type to chart scenario - assesses learning after tutoring session",
  "questions": [
    {
      "question_id": "q1",
      "question_text": "You need to show website traffic patterns across each day of the week for 3 months. Which chart family is most appropriate?",
      "options": [
        {"option_id": "A", "text": "Bar chart"},
        {"option_id": "B", "text": "Line or area chart"},
        {"option_id": "C", "text": "Pie chart"},
        {"option_id": "D", "text": "Donut chart"}
      ],
      "correct_answer": "B",
      "explanation": "Line or area charts are best for showing temporal trends and patterns over time.",
      "subskill": "map_temporal_to_line_or_area"
    },
    {
      "question_id": "q2",
      "question_text": "You want to compare quarterly sales across 4 regions. Which visualization is most effective?",
      "options": [
        {"option_id": "A", "text": "Line chart"},
        {"option_id": "B", "text": "Scatter plot"},
        {"option_id": "C", "text": "Column or bar chart"},
        {"option_id": "D", "text": "Histogram"}
      ],
      "correct_answer": "C",
      "explanation": "Column or bar charts excel at comparing values across discrete categories like regions.",
      "subskill": "map_categorical_to_bar_or_column"
    },
    {
      "question_id": "q3",
      "question_text": "You have 20 product categories but one category accounts for 60% of sales. What should you consider for composition visualization?",
      "options": [
        {"option_id": "A", "text": "A pie chart will work perfectly with all 20 categories"},
        {"option_id": "B", "text": "Consider grouping smaller categories or using a different chart type to handle many categories"},
        {"option_id": "C", "text": "Always use a line chart for this situation"},
        {"option_id": "D", "text": "Pie charts are never appropriate"}
      ],
      "correct_answer": "B",
      "explanation": "With many categories, consider grouping smaller ones or using alternative visualizations to avoid clutter while highlighting the dominant category.",
      "subskill": "account_for_composition_constraints"
    },
    {
      "question_id": "q4",
      "question_text": "Which data type is MOST suitable for a line chart?",
      "options": [
        {"option_id": "A", "text": "Unordered categories like department names"},
        {"option_id": "B", "text": "Time series data showing trends over days/months"},
        {"option_id": "C", "text": "Simple comparison of 3-4 product categories"},
        {"option_id": "D", "text": "Distribution of a single variable"}
      ],
      "correct_answer": "B",
      "explanation": "Line charts are designed for continuous or temporal data where showing trends and progression is important.",
      "subskill": "map_temporal_to_line_or_area"
    }
  ]
}
