{
  "test_id": "data_preparation_pre_001",
  "scenario": "data_preparation",
  "test_type": "pre_test",
  "description": "Pre-test for data preparation scenario - assesses baseline understanding of data cleaning and preparation",
  "questions": [
    {
      "question_id": "q1",
      "question_text": "You have monthly CSV files with different column names. What should you do before visualizing trends?",
      "options": [
        {"option_id": "A", "text": "Visualize each file separately"},
        {"option_id": "B", "text": "Standardize column names and merge the data"},
        {"option_id": "C", "text": "Only use the most recent file"},
        {"option_id": "D", "text": "Ignore the differences and combine directly"}
      ],
      "correct_answer": "B",
      "explanation": "Before visualization, you need to tidy/reshape data by standardizing column names and properly merging the datasets.",
      "subskill": "tidy_or_reshape_tables"
    },
    {
      "question_id": "q2",
      "question_text": "A column mixes dollars ($100) and percentages (15%) in the same field. What's the problem?",
      "options": [
        {"option_id": "A", "text": "No problem - charts handle mixed units automatically"},
        {"option_id": "B", "text": "Mixed units make the data uninterpretable and must be separated or standardized"},
        {"option_id": "C", "text": "Just convert everything to percentages"},
        {"option_id": "D", "text": "Use a pie chart to solve this"}
      ],
      "correct_answer": "B",
      "explanation": "Mixing units in the same column creates confusion. Data should be split or standardized before charting.",
      "subskill": "cast_data_types_before_charting"
    },
    {
      "question_id": "q3",
      "question_text": "15% of rows have missing values in a key column. What should you do before creating a chart?",
      "options": [
        {"option_id": "A", "text": "Ignore the missing values and chart anyway"},
        {"option_id": "B", "text": "Ask how to handle them: remove, impute, or flag them explicitly"},
        {"option_id": "C", "text": "Always fill them with zeros"},
        {"option_id": "D", "text": "Missing values don't affect visualizations"}
      ],
      "correct_answer": "B",
      "explanation": "Missing values require a conscious decision about handling strategy before visualization to avoid misleading charts.",
      "subskill": "handle_missing_values_consistently"
    },
    {
      "question_id": "q4",
      "question_text": "Why is it important to clean data before plotting?",
      "options": [
        {"option_id": "A", "text": "It's not important - visualizations show problems automatically"},
        {"option_id": "B", "text": "Charts look better with clean data"},
        {"option_id": "C", "text": "Dirty data can lead to incorrect visualizations and misleading insights"},
        {"option_id": "D", "text": "Cleaning is only needed for large datasets"}
      ],
      "correct_answer": "C",
      "explanation": "Plotting before cleaning can produce incorrect or misleading visualizations that lead to wrong conclusions.",
      "subskill": "tidy_or_reshape_tables"
    }
  ]
}
