{
  "test_id": "data_types_pre_001",
  "scenario": "data_types",
  "test_type": "pre_test",
  "description": "Pre-test for data types scenario - assesses baseline understanding of data type classification",
  "questions": [
    {
      "question_id": "q1",
      "question_text": "You have a column called 'customer_id' with values like 1001, 1002, 1003. What type of data is this?",
      "options": [
        {"option_id": "A", "text": "Continuous numerical data suitable for mathematical operations"},
        {"option_id": "B", "text": "An identifier that should not be used for quantitative encoding"},
        {"option_id": "C", "text": "Ordinal categorical data"},
        {"option_id": "D", "text": "Discrete numerical data for aggregation"}
      ],
      "correct_answer": "B",
      "explanation": "Customer IDs are identifiers, not true numerical values. They shouldn't be used for mathematical operations or quantitative encodings.",
      "subskill": "flag_identifier_fields"
    },
    {
      "question_id": "q2",
      "question_text": "A survey column has responses: 'Strongly Disagree', 'Disagree', 'Neutral', 'Agree', 'Strongly Agree'. What type of data is this?",
      "options": [
        {"option_id": "A", "text": "Nominal categorical data"},
        {"option_id": "B", "text": "Continuous numerical data"},
        {"option_id": "C", "text": "Ordinal categorical data"},
        {"option_id": "D", "text": "An identifier field"}
      ],
      "correct_answer": "C",
      "explanation": "This is ordinal data because the categories have a meaningful order from strongly disagree to strongly agree.",
      "subskill": "differentiate_ordinal_vs_nominal"
    },
    {
      "question_id": "q3",
      "question_text": "Which of the following is a categorical variable?",
      "options": [
        {"option_id": "A", "text": "Temperature in degrees Celsius"},
        {"option_id": "B", "text": "Product category (Electronics, Clothing, Food)"},
        {"option_id": "C", "text": "Monthly revenue in dollars"},
        {"option_id": "D", "text": "Customer age in years"}
      ],
      "correct_answer": "B",
      "explanation": "Product category is categorical because it represents discrete groups without inherent numerical meaning.",
      "subskill": "distinguish_categorical_vs_numerical"
    },
    {
      "question_id": "q4",
      "question_text": "A column contains values: 15.5, 23.7, 31.2, 45.0. What type of numerical data is this most likely?",
      "options": [
        {"option_id": "A", "text": "Discrete numerical data"},
        {"option_id": "B", "text": "Continuous numerical data"},
        {"option_id": "C", "text": "Nominal categorical data"},
        {"option_id": "D", "text": "Identifier data"}
      ],
      "correct_answer": "B",
      "explanation": "The decimal values indicate continuous data that can take any value within a range.",
      "subskill": "separate_discrete_vs_continuous"
    }
  ]
}
