{
  "test_id": "data_types_post_001",
  "scenario": "data_types",
  "test_type": "post_test",
  "description": "Post-test for data types scenario - assesses learning after tutoring session",
  "questions": [
    {
      "question_id": "q1",
      "question_text": "You see a column 'employee_code' with values like 501, 502, 503. Before using it in a visualization, what should you consider?",
      "options": [
        {"option_id": "A", "text": "Calculate the average employee code for insights"},
        {"option_id": "B", "text": "Verify if these are identifiers or actual quantitative values"},
        {"option_id": "C", "text": "Treat them as ordinal categories"},
        {"option_id": "D", "text": "Use them directly in a line chart"}
      ],
      "correct_answer": "B",
      "explanation": "Numeric codes may be identifiers rather than true quantitative values. You should verify their meaning before using them in quantitative encodings.",
      "subskill": "flag_identifier_fields"
    },
    {
      "question_id": "q2",
      "question_text": "Education level is encoded as: 'High School', 'Bachelor', 'Master', 'PhD'. How should you classify this data?",
      "options": [
        {"option_id": "A", "text": "Nominal categorical - no inherent order"},
        {"option_id": "B", "text": "Ordinal categorical - has meaningful order"},
        {"option_id": "C", "text": "Continuous numerical"},
        {"option_id": "D", "text": "Discrete numerical"}
      ],
      "correct_answer": "B",
      "explanation": "Education levels have a natural progression/order, making this ordinal categorical data.",
      "subskill": "differentiate_ordinal_vs_nominal"
    },
    {
      "question_id": "q3",
      "question_text": "Which variable is best classified as numerical rather than categorical?",
      "options": [
        {"option_id": "A", "text": "Customer satisfaction rating (Satisfied/Unsatisfied)"},
        {"option_id": "B", "text": "City name"},
        {"option_id": "C", "text": "Number of purchases per customer"},
        {"option_id": "D", "text": "Subscription tier (Gold/Silver/Bronze)"}
      ],
      "correct_answer": "C",
      "explanation": "Number of purchases is a numerical value that can be measured and calculated, unlike the categorical options.",
      "subskill": "distinguish_categorical_vs_numerical"
    },
    {
      "question_id": "q4",
      "question_text": "A column shows 'Number of children in household': 0, 1, 2, 3, 4. What type of numerical data is this?",
      "options": [
        {"option_id": "A", "text": "Continuous - can take any value"},
        {"option_id": "B", "text": "Discrete - can only take specific whole number values"},
        {"option_id": "C", "text": "Ordinal categorical"},
        {"option_id": "D", "text": "Identifier"}
      ],
      "correct_answer": "B",
      "explanation": "Number of children can only be whole numbers (you can't have 2.5 children), making it discrete numerical data.",
      "subskill": "separate_discrete_vs_continuous"
    }
  ]
}
