{
  "test_id": "chart_to_task_pre_001",
  "scenario": "chart_to_task",
  "test_type": "pre_test",
  "description": "Pre-test for chart to task scenario - assesses baseline understanding of matching analytical tasks with charts",
  "questions": [
    {
      "question_id": "q1",
      "question_text": "A teacher wants students to compare sales performance across five regions. Which chart type best serves this task?",
      "options": [
        {"option_id": "A", "text": "Line chart to show trends"},
        {"option_id": "B", "text": "Bar or column chart for direct comparison"},
        {"option_id": "C", "text": "Pie chart to show composition"},
        {"option_id": "D", "text": "Scatter plot to show correlation"}
      ],
      "correct_answer": "B",
      "explanation": "Comparison tasks are best served by bar or column charts which make it easy to compare values across categories.",
      "subskill": "match_comparison_tasks_to_bars_or_columns"
    },
    {
      "question_id": "q2",
      "question_text": "You need to show whether customer satisfaction is improving over the past 12 months. What type of analytical task is this?",
      "options": [
        {"option_id": "A", "text": "Comparison task"},
        {"option_id": "B", "text": "Composition task"},
        {"option_id": "C", "text": "Trend task"},
        {"option_id": "D", "text": "Distribution task"}
      ],
      "correct_answer": "C",
      "explanation": "Showing change over time is a trend analysis task, best served by line or area charts.",
      "subskill": "match_trend_tasks_to_lines_or_areas"
    },
    {
      "question_id": "q3",
      "question_text": "Someone wants to understand the spread of delivery times (min, max, median, quartiles). What is the analytical intent?",
      "options": [
        {"option_id": "A", "text": "Trend analysis"},
        {"option_id": "B", "text": "Comparison"},
        {"option_id": "C", "text": "Distribution analysis"},
        {"option_id": "D", "text": "Composition"}
      ],
      "correct_answer": "C",
      "explanation": "Understanding spread, quartiles, and range is distribution analysis, often shown with histograms or box plots.",
      "subskill": "select_distribution_views_for_spread"
    },
    {
      "question_id": "q4",
      "question_text": "What's the difference between ranking regions by sales vs. showing sales trends over time?",
      "options": [
        {"option_id": "A", "text": "There is no difference - both use the same chart"},
        {"option_id": "B", "text": "Ranking is a comparison task; trends show change over time"},
        {"option_id": "C", "text": "Ranking needs a pie chart; trends need a bar chart"},
        {"option_id": "D", "text": "Both require scatter plots"}
      ],
      "correct_answer": "B",
      "explanation": "Ranking is about comparing static values (use bars), while trends show temporal change (use lines). These are different analytical tasks.",
      "subskill": "identify_task_intent"
    }
  ]
}
