{
  "test_id": "type_to_chart_pre_001",
  "scenario": "type_to_chart",
  "test_type": "pre_test",
  "description": "Pre-test for type to chart scenario - assesses baseline understanding of pairing data types with charts",
  "questions": [
    {
      "question_id": "q1",
      "question_text": "You have monthly revenue data over 2 years. Which chart type is most appropriate?",
      "options": [
        {"option_id": "A", "text": "Pie chart"},
        {"option_id": "B", "text": "Line chart"},
        {"option_id": "C", "text": "Bar chart with categories"},
        {"option_id": "D", "text": "Scatter plot"}
      ],
      "correct_answer": "B",
      "explanation": "Line charts are ideal for temporal/time-series data to show trends over time.",
      "subskill": "map_temporal_to_line_or_area"
    },
    {
      "question_id": "q2",
      "question_text": "You need to compare sales across 5 different product categories. Which chart is best?",
      "options": [
        {"option_id": "A", "text": "Line chart"},
        {"option_id": "B", "text": "Area chart"},
        {"option_id": "C", "text": "Bar or column chart"},
        {"option_id": "D", "text": "Histogram"}
      ],
      "correct_answer": "C",
      "explanation": "Bar or column charts are ideal for comparing categorical data across different groups.",
      "subskill": "map_categorical_to_bar_or_column"
    },
    {
      "question_id": "q3",
      "question_text": "What is a key problem with using a pie chart when you have 15 categories?",
      "options": [
        {"option_id": "A", "text": "Pie charts don't support that many slices"},
        {"option_id": "B", "text": "Too many slices make the chart hard to read and compare"},
        {"option_id": "C", "text": "Pie charts only work with temporal data"},
        {"option_id": "D", "text": "There is no problem - pie charts scale well"}
      ],
      "correct_answer": "B",
      "explanation": "Pie charts become cluttered and difficult to interpret with many categories, making comparisons challenging.",
      "subskill": "account_for_composition_constraints"
    },
    {
      "question_id": "q4",
      "question_text": "Someone wants to use a line chart to show customer segments 'Gold', 'Silver', 'Bronze'. What's the issue?",
      "options": [
        {"option_id": "A", "text": "Line charts should be used for continuous or temporal data, not unordered categories"},
        {"option_id": "B", "text": "Line charts work fine for any categorical data"},
        {"option_id": "C", "text": "There are too few categories"},
        {"option_id": "D", "text": "The segment names are too long"}
      ],
      "correct_answer": "A",
      "explanation": "Line charts imply continuity or progression, which doesn't make sense for unordered categorical data like customer segments.",
      "subskill": "map_categorical_to_bar_or_column"
    }
  ]
}
